{
  "knowledge_id": "evidence:certification-expiry-validation",
  "corpus_type": "evidence",
  "evidence_status": "production",
  "evidence_version": "1.0.0",
  "owner": "compliance-apac@aairp",
  "owner_type": "compliance",
  "last_reviewed": "2026-07-01T00:00:00.000Z",
  "review_status": "legal_reviewed",
  "confidence_level": "high",
  "case_refs": [],
  "evidence_id": "certification-expiry-validation",
  "evidence_type_key": "certification",
  "requirement_scope": "certification-expiry",
  "evidence_purpose": "Ensure certification evidence remains valid for the campaign flight dates and review timestamp.",
  "summary": "Certification substantiation must not be expired relative to campaign dates and review date.",
  "review_guidance": "TRIGGER: Certification mark with visible validity period or registration number. ACTION: Check expiry against campaign schedule. CHECK: Issue date, expiry date, renewal status. ESCALATE IF: Certificate expired before publication.",
  "evidence_purpose_tags": [
    "certification-expiry"
  ],
  "resolves_expected_evidence_types": [
    "certification"
  ],
  "document_ref_spec": {
    "ref_kind": "certification_record",
    "id_format": "{issuer}-{cert_number}",
    "storage_system": "compliance_dms",
    "example": "TISI-2023-78901"
  },
  "validity_window": {
    "typical_validity_months": 12,
    "renewal_review_trigger": "annual",
    "notes": "Reviewer confirms instance validity."
  },
  "applicability": {
    "countries": [
      "SG",
      "MY",
      "TH",
      "ID",
      "KR"
    ],
    "claim_types": [
      "certification-claim"
    ],
    "modalities": [
      "text",
      "image"
    ]
  },
  "requirement_level": "required",
  "linkage": {
    "regulations": [
      "regulation:kr-ks-certification-mark",
      "regulation:id-sni-certification-mark"
    ],
    "rules": [
      "demo-apac-sa-certification-evidence"
    ],
    "skills": [
      "skill:certification-claim-review"
    ]
  },
  "benchmark_refs": [
    "RC18-004"
  ],
  "validation_criteria": {
    "checks": [
      "Confirm certificate expiry date is after campaign end date",
      "Verify renewal certificate if within 30-day grace window",
      "Check registration number resolves to active record"
    ],
    "reject_if": [
      "Certificate expired at review date"
    ]
  },
  "tags": [
    "confidence:high",
    "evidence:required",
    "certification"
  ]
}
