{
  "knowledge_id": "evidence:efficacy-superlative-substantiation",
  "corpus_type": "evidence",
  "evidence_status": "production",
  "evidence_version": "1.0.0",
  "owner": "compliance-apac@aairp",
  "owner_type": "compliance",
  "last_reviewed": "2026-07-01T00:00:00.000Z",
  "review_status": "legal_reviewed",
  "confidence_level": "high",
  "case_refs": [],
  "evidence_id": "efficacy-superlative-substantiation",
  "evidence_type_key": "substantiation_general",
  "requirement_scope": "efficacy-substantiation",
  "evidence_purpose": "Substantiation for superlative efficacy and testimonial claims requiring qualification.",
  "summary": "Superlative efficacy claims require substantiation file or must be qualified to typical-results framing.",
  "review_guidance": "TRIGGER: Clinically proven, guaranteed, miracle, or 100% efficacy language. ACTION: Locate substantiation or require qualification. CHECK: Clinical reference, testimonial verifiability. ESCALATE IF: Cure or miracle language on health product.",
  "evidence_purpose_tags": [
    "efficacy-substantiation"
  ],
  "resolves_expected_evidence_types": [
    "substantiation_general"
  ],
  "applicability": {
    "countries": [
      "SG",
      "MY",
      "TH"
    ],
    "claim_types": [
      "superlative-claim"
    ],
    "modalities": [
      "text"
    ]
  },
  "requirement_level": "required",
  "linkage": {
    "regulations": [
      "regulation:sg-asasa-substantiation"
    ],
    "rules": [
      "demo-sg-health-superlative"
    ],
    "skills": [
      "skill:superlative-claim-review"
    ],
    "rewrites": [
      "rewrite:qualify-efficacy"
    ]
  },
  "benchmark_refs": [
    "sg-health-warn-superlative"
  ],
  "validation_criteria": {
    "checks": [
      "Confirm substantiation supports efficacy wording",
      "Require qualification for omnibus results",
      "Verify testimonial attribution if used"
    ],
    "reject_if": [
      "Absolute efficacy with no substantiation"
    ]
  },
  "tags": [
    "confidence:high",
    "evidence:required",
    "superlative"
  ]
}
