{
  "knowledge_id": "evidence:performance-claim-substantiation",
  "corpus_type": "evidence",
  "evidence_status": "production",
  "evidence_version": "1.0.0",
  "owner": "compliance-apac@aairp",
  "owner_type": "compliance",
  "last_reviewed": "2026-07-01T00:00:00.000Z",
  "review_status": "legal_reviewed",
  "confidence_level": "high",
  "case_refs": [],
  "evidence_id": "performance-claim-substantiation",
  "evidence_type_key": "substantiation_general",
  "requirement_scope": "performance-substantiation",
  "evidence_purpose": "General substantiation requirement for efficacy and performance advertising claims.",
  "summary": "Performance claims require substantiation file demonstrating typical results under disclosed conditions.",
  "review_guidance": "TRIGGER: Efficacy or performance benefit claim. ACTION: Locate substantiation file. CHECK: Study design, typical results framing. ESCALATE IF: No file or absolute wording unsupported.",
  "evidence_purpose_tags": [
    "performance-substantiation"
  ],
  "resolves_expected_evidence_types": [
    "substantiation_general"
  ],
  "applicability": {
    "countries": [
      "SG",
      "MY",
      "TH"
    ],
    "claim_types": [
      "performance-claim"
    ],
    "modalities": [
      "text",
      "image"
    ]
  },
  "requirement_level": "required",
  "linkage": {
    "regulations": [
      "regulation:sg-hsa-efficacy-performance",
      "regulation:id-bpom-performance-claims"
    ],
    "rules": [
      "demo-apac-sa-performance-claim"
    ],
    "skills": [
      "skill:performance-claim-review"
    ],
    "rewrites": [
      "rewrite:qualify-performance"
    ]
  },
  "benchmark_refs": [
    "AF-004"
  ],
  "validation_criteria": {
    "checks": [
      "Confirm substantiation file exists",
      "Verify claim wording matches file conclusions",
      "Check typical-use conditions disclosed"
    ],
    "reject_if": [
      "Substantiation file missing"
    ]
  },
  "tags": [
    "confidence:high",
    "evidence:required",
    "performance"
  ]
}
